tutor_prompt,student_persona,course,exercise_number,judge_prompt,judge_rubric,transcript_name,deductions
tutor_01,chaotic_01,philosophy,01,judge_02,rubric_02,transcript_01,
tutor_01,chaotic_01,philosophy,01,judge_02,rubric_02,transcript_02,"1_pedagogy/1.1: One turn partially blurred the line between tutoring and doing the work by providing a smoothed, essentially paste-ready transition after the student asked for something to paste.
1_pedagogy/1.3: Limited explicit meta-learning/process explanation (why the tutor is refusing to write it / how to approach constructing the argument) beyond brief boundary statements."
tutor_01,chaotic_01,urban_studies,01,judge_02,rubric_02,transcript_03,1_pedagogy/1.1: Tutor provided submission-ready phrasing (table entry + APA-style citation) for GDP once the student supplied the value; this slightly blurs the line between tutoring and doing the write-up (though the tutor did not supply the underlying numbers beyond what the student gave).
tutor_01,chaotic_01,urban_studies,01,judge_02,rubric_02,transcript_04,1_pedagogy/1.3: Tutor did not explicitly explain the learning-ownership rationale for refusing to provide submission-ready work beyond brief boundary statements; limited meta-learning/process coaching beyond tactical instructions.
tutor_01,chaotic_01,urban_studies,02,judge_02,rubric_02,transcript_05,"1_pedagogy/1.1: Tutor provided minimally rewritten near-final justification sentences and a nearly complete table, which slightly blurs the line between tutoring and doing the work (though still left blanks and required student inputs/citations)."
tutor_01,chaotic_01,urban_studies,02,judge_02,rubric_02,transcript_06,"1_pedagogy/1.1: Provided pasteable, largely fully written justification drafts (with blanks) which partially blurs the line between tutoring and doing the work.
1_pedagogy/1.3: Limited explicit meta-learning about why the tutor is using questions/withholding direct completion beyond brief boundary statements; little methodology reflection beyond task mechanics."
tutor_01,chaotic_01,urban_studies,03,judge_02,rubric_02,transcript_07,"1_pedagogy/1.3: Tutor enforces boundaries but does not explicitly explain the learning rationale/method beyond brief 'cross the line' statements; limited process/methodology coaching beyond templates and checks.
2_dialogue_quality/2.1: Major redundancy/spiraling: turns 7–10 repeatedly ask the student to paste sentences and restate the same instruction without new progress or synthesis.
3_communication_quality/3.1: Some turns are longer/more repetitive than necessary, especially late-stage prompting to paste sentences, which could have been consolidated."
tutor_01,chaotic_01,urban_studies,03,judge_02,rubric_02,transcript_08,"1_pedagogy/1.3: Tutor enforces boundaries but gives limited explicit meta-learning explanation (why questions/ownership help learning) beyond brief 'coach, not author' statements."
tutor_01,chaotic_02,philosophy,01,judge_02,rubric_02,transcript_09,"1_pedagogy/1.1: Provided a highly filled-in template for a one-sentence general account and a case map that could be close to paste-ready, slightly blurring the line between scaffolding and doing the work."
tutor_01,chaotic_02,philosophy,01,judge_02,rubric_02,transcript_10,"1_pedagogy/1.1: Later turns partially blur the line between tutoring and doing the work by providing near-final, submission-shaped prose (fill-in paragraph and subsequent polishing), even while disclaiming authorship.
1_pedagogy/1.3: Limited explicit meta-learning/methodology feedback beyond boundary statements; little explanation of why the questioning/scaffolding approach supports learning/ownership."
tutor_01,chaotic_02,urban_studies,01,judge_02,rubric_02,transcript_11,
tutor_01,chaotic_02,urban_studies,01,judge_02,rubric_02,transcript_12,"1_pedagogy/1.1: Provided several paste-ready sentences/notes (Köppen, race/ethnicity overlap, GDP note), slightly blurring the line between tutoring and doing minor write-up work, though still not providing the actual table values."
tutor_01,chaotic_02,urban_studies,02,judge_02,rubric_02,transcript_13,"1_pedagogy/1.3: Limited explicit meta-learning rationale beyond brief boundary-setting; could more clearly explain why the tutor is refusing to provide paste-ready content and how to generalize the method to future rows/assignments.
3_communication_quality/3.1: Some turns are longer than necessary (multi-part lists/templates) where shorter, more interactive steps might suffice, though clarity remains high."
tutor_01,chaotic_02,urban_studies,02,judge_02,rubric_02,transcript_14,"1_pedagogy/1.1: Tutor provided polished, paste-ready text for core assignment components (row justifications and final one-line priority statements), reducing guided discovery/ownership.
1_pedagogy/1.3: Limited explicit meta-learning/process feedback beyond boundary-setting; little explanation of learning strategy besides refusing to complete work."
tutor_01,chaotic_02,urban_studies,03,judge_02,rubric_02,transcript_15,"1_pedagogy/1.1: Provided paste-ready paragraphs/sentences that the student could submit with minimal additional work, partially blurring tutoring vs. doing the assignment.
1_pedagogy/1.3: Did not explicitly explain the learning-ownership rationale for refusing to provide answers beyond brief boundary statements; limited meta-method/process feedback."
tutor_01,chaotic_02,urban_studies,03,judge_02,rubric_02,transcript_16,"1_pedagogy/1.1: Provided near submission-ready one-sentence actor descriptions and a largely complete forum paragraph draft, which partially blurs the line between tutoring and doing the work (even though student was asked to add details).
1_pedagogy/1.3: Limited explicit methodology/process feedback beyond boundary-setting; tutor rarely explains learning strategy or how to generalize the actor-mapping method beyond this instance.
3_communication_quality/3.2: Tutor assigned an implied formal evaluation by calling the sentence 'defensible,' which functions like a judgment of acceptability; also flirted with reassurance about academic integrity/flagging even while refusing guarantees."
tutor_01,chaotic_03,philosophy,01,judge_02,rubric_02,transcript_17,
tutor_01,chaotic_03,philosophy,01,judge_02,rubric_02,transcript_18,1_pedagogy/1.3: Tutor rarely/never explicitly explained the tutoring boundary or learning rationale beyond refusal; limited meta-method commentary on why questions/scaffolds are used.
tutor_01,chaotic_03,urban_studies,01,judge_02,rubric_02,transcript_19,"1_pedagogy/1.3: Tutor did not explicitly explain the broader learning/ownership rationale for using questions beyond brief boundary statements; limited meta-method/process coaching framing.
3_communication_quality/3.1: Turn 9 includes an internal JSON/meta block ('pedagogical-reasoning') shown to the student, reducing clarity and creating avoidable confusion.
3_communication_quality/3.3: Formatting/medium issue: raw JSON wrapper in Turn 9 is not an appropriate student-facing format and could distract or confuse."
tutor_01,chaotic_03,urban_studies,01,judge_02,rubric_02,transcript_20,"1_pedagogy/1.3: Limited explicit methodology/process coaching beyond immediate task steps; could have provided a repeatable workflow for remaining metrics (GDP/income/Köppen) and how to evaluate comparability across sources.
3_communication_quality/3.1: One response could have been more bite-sized; the initial source guidance included multiple bullets and checks that might have been chunked into shorter steps."
tutor_01,chaotic_03,urban_studies,02,judge_02,rubric_02,transcript_21,
tutor_01,chaotic_03,urban_studies,02,judge_02,rubric_02,transcript_22,
tutor_01,chaotic_03,urban_studies,03,judge_02,rubric_02,transcript_23,"1_pedagogy/1.1: Provided extensive “candidate hooks” and actor menus that partially blur the line by supplying many near-ready content elements, even though the tutor refused paste-ready bullets.
3_communication_quality/3.1: A few turns were longer and more list-heavy than necessary (e.g., long hook lists), where shorter interactive prompts could suffice."
tutor_01,chaotic_03,urban_studies,03,judge_02,rubric_02,transcript_24,3_communication_quality/3.1: One response offered multiple alternative phrasings and a near-final sentence; slightly more content than necessary for bite-sized guidance.
